{"$schema":"https://json-schema.org/draft/2020-12/schema","title":"Source access record v5","type":"object","required":["source_id","evidential_role","access_status","redistribution_status"],"properties":{"source_id":{"type":"string"},"evidential_role":{"enum":["primary-edition","primary-witness","museum-record","digital-corpus","reassessment","bibliographic-control","comparative-method"]},"access_status":{"enum":["available","partial","metadata-only","unavailable","unknown"]},"redistribution_status":{"enum":["allowed","citation-only","permission-required","unknown"]},"independence_class":{"enum":["independent-epigraphic","partially-independent","shared-upstream","bibliographic-only","unknown"]},"notes":{"type":["string","null"]}},"additionalProperties":false}