[
  {
    "source_id": "CHIC1996",
    "evidential_role": "primary-edition",
    "access_status": "partial",
    "redistribution_status": "citation-only",
    "independence_class": "independent-epigraphic",
    "notes": "Public CEFAEL publisher page images consulted for pp. 91 and 93. Five printed transnumerations on two H-series objects source-checked by project; entire corpus and independent epigraphic certification remain unverified. Images not redistributed."
  },
  {
    "source_id": "EFA-CHIC",
    "evidential_role": "bibliographic-control",
    "access_status": "available",
    "redistribution_status": "citation-only",
    "independence_class": "bibliographic-only",
    "notes": "Publisher metadata/control record."
  },
  {
    "source_id": "FERRARA-MONTECCHI-VALERIO-2021",
    "evidential_role": "reassessment",
    "access_status": "available",
    "redistribution_status": "citation-only",
    "independence_class": "partially-independent",
    "notes": "Repertoire reassessment."
  },
  {
    "source_id": "FERRARA-2023-LOST-SIGNS",
    "evidential_role": "reassessment",
    "access_status": "available",
    "redistribution_status": "citation-only",
    "independence_class": "partially-independent",
    "notes": "Writing/non-writing methodology."
  },
  {
    "source_id": "FERRARA-2024-REPERTOIRES",
    "evidential_role": "reassessment",
    "access_status": "available",
    "redistribution_status": "citation-only",
    "independence_class": "partially-independent",
    "notes": "Repertoire history/reassessment."
  },
  {
    "source_id": "JASINK-BOMBARDIERI-CHS",
    "evidential_role": "digital-corpus",
    "access_status": "available",
    "redistribution_status": "unknown",
    "independence_class": "partially-independent",
    "notes": "Digital seal corpus; redistribution terms must be checked before importing protected content."
  }
]
